{
  "tenant_id": "11111111-1111-4111-8111-111111111111",
  "operation_id": "22222222-2222-4222-8222-222222222222",
  "attempt_id": "33333333-3333-4333-8333-333333333333",
  "state": "succeeded",
  "resources_state": "present",
  "runtime_tenant_id": "66666666-6666-4666-8666-666666666666",
  "error_code": null
}
